{
  "$schema": "https://json-schema.org/draft/2020-12/schema",
  "$id": "nasaex/phase0/result-record.schema.json",
  "title": "Phase 0 result record",
  "description": "docs/phase0/results/<spike>/<record-id>/record.json (spike S1 to S5, or the optional non-gating X1). Immutable once committed. Contains identifiers and hashes only; no absolute host paths, user names or host names. Three kinds: spike-run and repro (the outcome of runs) and review (the reviewed judgement of S2.7, see the kind review rule below). The status pending is never stored: the verdict of a spike-run record stays PASS or FAIL, and the S2 status pending is derived only when every other S2 scenario passed, the automated S2.7 checks pass and no review record names the newest spike-run under the current criteria version; a review of an older run does not affect this status (data-model.md, Acceptance scenario).",
  "type": "object",
  "required": ["record_id", "kind", "spike", "criteria_version", "criteria_sha256"],
  "additionalProperties": false,
  "properties": {
    "record_id": {
      "type": "string",
      "pattern": "^((S[1-5]|X1)|repro-(S[1-5]|X1)|review-S2)-[0-9]{8}T[0-9]{6}Z-v[0-9]+$",
      "description": "<spike>-<UTC timestamp, basic format>-v<criteria version>; repro records use the repro- prefix, review records the review-S2- prefix."
    },
    "kind": { "enum": ["spike-run", "repro", "review"] },
    "spike": { "enum": ["S1", "S2", "S3", "S4", "S5", "X1"] },
    "gating": {
      "type": "boolean",
      "description": "False for X1 records: the experiment never gates an ADR. Required for X1, absent otherwise."
    },
    "criteria_version": { "type": "integer", "minimum": 1 },
    "criteria_sha256": {
      "type": "string",
      "pattern": "^[0-9a-f]{64}$",
      "description": "Must equal the lock entry of this criteria version in docs/phase0/criteria/frozen.lock."
    },
    "environment": { "$ref": "#/$defs/environment" },
    "date": {
      "type": "object",
      "required": ["start", "end"],
      "additionalProperties": false,
      "properties": {
        "start": { "type": "string", "format": "date-time" },
        "end": { "type": "string", "format": "date-time" }
      }
    },
    "scenarios": {
      "type": "array",
      "minItems": 1,
      "items": { "$ref": "#/$defs/scenarioResult" }
    },
    "verdict": {
      "enum": ["PASS", "FAIL"],
      "description": "PASS iff every scenario of the named criteria version is present with outcome pass. A missing scenario counts as fail. Never pending. In an S2 spike-run record the S2.7 outcome is that of its automated step checks, so a failed step check makes the verdict FAIL; the S2 status is pending only when those checks pass, every other S2 scenario passed and no review record names the newest spike-run under the current criteria version; a review of an older run does not affect this status. Any other failed scenario makes the verdict FAIL regardless of review. The status is never read from this field alone."
    },
    "fallback_decision": {
      "type": "string",
      "minLength": 1,
      "description": "Required on FAIL for S1 to S5, including a failing S2 review record: the fallback that applies (spec FR-007, FR-031); omitted for X1, which has no fallback."
    },
    "coverage": {
      "type": "object",
      "description": "Numbers behind SC-005 (crash points enumerated and executed per kill mode), SC-006 (predicted versus actual file sets), SC-007 (transitions), SC-008 (rebuild durations).",
      "additionalProperties": true
    },
    "required_settings": {
      "type": "object",
      "description": "Mount or share settings found necessary (FR-013), the create policy, branch modes and out-of-space settings (S1.2, S1.9), the verified procedure for branch changes made directly by the mover (S1.10), the written recovery procedure of S2.7.",
      "additionalProperties": true
    },
    "residual_risk": {
      "type": "array",
      "minItems": 1,
      "items": { "type": "string" },
      "description": "At least: device-level volatile write caches are not emulated; virtual disks stand in for real disks."
    },
    "supersedes": {
      "type": "string",
      "pattern": "^((S[1-5]|X1)|repro-(S[1-5]|X1))-[0-9]{8}T[0-9]{6}Z-v[0-9]+$",
      "description": "Earlier record that this run re-runs after a documented design correction. The earlier record is never deleted."
    },
    "repro_runs": {
      "type": "array",
      "description": "kind=repro only: the record ids of the three consecutive clean runs (SC-004).",
      "minItems": 3,
      "maxItems": 3,
      "items": { "type": "string" }
    },
    "evidence_archive": {
      "type": "object",
      "required": ["path", "sha256"],
      "additionalProperties": false,
      "properties": {
        "path": { "type": "string", "pattern": "^evidence\\.tar\\.xz$" },
        "sha256": { "type": "string", "pattern": "^[0-9a-f]{64}$" }
      }
    },
    "reviewed_record": {
      "type": "string",
      "pattern": "^S2-[0-9]{8}T[0-9]{6}Z-v[0-9]+$",
      "description": "kind=review only: the id of the S2 spike-run record whose S2.7 this record judges. It must name the same criteria version and criteria_sha256 as this record."
    },
    "review": {
      "type": "object",
      "description": "kind=review only: the reviewed judgement of the written recovery procedure (S2.7, spec FR-002).",
      "required": ["scenario", "outcome", "reviewer", "date", "evidence"],
      "additionalProperties": false,
      "properties": {
        "scenario": { "const": "S2.7" },
        "outcome": { "enum": ["pass", "fail"], "description": "The final S2.7 outcome. Only pass and fail exist: a review that is not yet made is the absence of this record (the derived status pending)." },
        "reviewer": { "type": "string", "minLength": 1, "description": "Reviewer identity as a public handle or role; no host name, no e-mail address." },
        "date": { "type": "string", "format": "date-time", "description": "UTC time of the judgement." },
        "evidence": {
          "type": "array",
          "minItems": 1,
          "description": "What was reviewed: entries inside the evidence archive of the reviewed record (for example the rendered procedure text), pinned by hash.",
          "items": {
            "type": "object",
            "required": ["path", "sha256"],
            "additionalProperties": false,
            "properties": {
              "path": { "type": "string", "pattern": "^[^/].*$" },
              "sha256": { "type": "string", "pattern": "^[0-9a-f]{64}$" }
            }
          }
        },
        "notes": { "type": "string" }
      }
    }
  },
  "allOf": [
    {
      "if": { "properties": { "kind": { "enum": ["spike-run", "repro"] } }, "required": ["kind"] },
      "then": {
        "required": ["environment", "date", "scenarios", "verdict", "residual_risk", "evidence_archive"],
        "properties": { "record_id": { "not": { "pattern": "^review-" } } },
        "not": { "anyOf": [{ "required": ["reviewed_record"] }, { "required": ["review"] }] }
      }
    },
    {
      "if": { "properties": { "kind": { "const": "review" } }, "required": ["kind"] },
      "then": {
        "required": ["reviewed_record", "review"],
        "properties": {
          "spike": { "const": "S2" },
          "record_id": { "pattern": "^review-S2-" }
        },
        "propertyNames": { "enum": ["record_id", "kind", "spike", "criteria_version", "criteria_sha256", "reviewed_record", "review", "fallback_decision"] },
        "allOf": [
          {
            "if": {
              "properties": {
                "review": {
                  "properties": { "outcome": { "const": "fail" } },
                  "required": ["outcome"]
                }
              },
              "required": ["review"]
            },
            "then": { "required": ["fallback_decision"] }
          }
        ]
      }
    },
    {
      "if": {
        "properties": {
          "verdict": { "const": "FAIL" },
          "spike": { "enum": ["S1", "S2", "S3", "S4", "S5"] }
        },
        "required": ["verdict", "spike"]
      },
      "then": { "required": ["fallback_decision"] }
    },
    {
      "if": { "properties": { "spike": { "const": "X1" } }, "required": ["spike"] },
      "then": { "required": ["gating"], "properties": { "gating": { "const": false } } }
    },
    {
      "if": { "properties": { "kind": { "const": "repro" } }, "required": ["kind"] },
      "then": { "required": ["repro_runs"] }
    }
  ],
  "$defs": {
    "environment": {
      "type": "object",
      "required": ["repo_commit", "flake_lock_sha256", "nixpkgs_rev", "profile", "tool_versions", "host", "kvm"],
      "additionalProperties": false,
      "properties": {
        "repo_commit": { "type": "string", "pattern": "^[0-9a-f]{40}$" },
        "flake_lock_sha256": { "type": "string", "pattern": "^[0-9a-f]{64}$" },
        "nixpkgs_rev": { "type": "string", "pattern": "^[0-9a-f]{40}$" },
        "profile": { "enum": ["large", "small", "s5", "x1"] },
        "disks": {
          "type": "array",
          "items": {
            "type": "object",
            "required": ["serial", "role", "size_mib"],
            "additionalProperties": false,
            "properties": {
              "serial": { "type": "string" },
              "role": { "enum": ["pool", "archive", "parity", "replacement", "system", "state"] },
              "size_mib": { "type": "integer", "minimum": 1 },
              "filesystem": { "type": "string" }
            }
          }
        },
        "tool_versions": {
          "type": "object",
          "description": "Observed inside the guest or on the host at run time, not copied from documentation.",
          "required": ["kernel", "qemu"],
          "additionalProperties": { "type": "string" },
          "properties": {
            "kernel": { "type": "string" },
            "qemu": { "type": "string" },
            "mergerfs": { "type": "string" },
            "snapraid": { "type": "string" },
            "btrfs_progs": { "type": "string" },
            "snapper": { "type": "string" },
            "snapraid_btrfs": { "type": "string", "description": "Pinned revision of the snapshot tooling, if used." },
            "samba": { "type": "string" },
            "nix": { "type": "string" }
          }
        },
        "kernel_config": {
          "type": "object",
          "description": "Pre-flight results as read from the running kernel (for X1: CONFIG_FUSE_PASSTHROUGH and CONFIG_OVERLAY_FS_REDIRECT_DIR; for S1 to S4: btrfs and FUSE support).",
          "additionalProperties": { "type": "string" }
        },
        "host": {
          "type": "object",
          "required": ["cpu_class", "vcpus", "memory_gib"],
          "additionalProperties": false,
          "properties": {
            "cpu_class": { "type": "string", "description": "CPU model class only (for example vendor and family); no host name." },
            "vcpus": { "type": "integer", "minimum": 1 },
            "memory_gib": { "type": "integer", "minimum": 1 }
          }
        },
        "kvm": { "const": true, "description": "Must be true for a record; a run without KVM never produces one." },
        "vm_resources": {
          "type": "object",
          "additionalProperties": {
            "type": "object",
            "properties": { "vcpus": { "type": "integer" }, "memory_mib": { "type": "integer" } }
          }
        }
      }
    },
    "scenarioResult": {
      "type": "object",
      "required": ["id", "outcome"],
      "additionalProperties": false,
      "properties": {
        "id": { "type": "string", "pattern": "^(S[1-5]|X1)\\.[0-9]+$" },
        "outcome": {
          "enum": ["pass", "fail", "error", "skipped", "flaky"],
          "description": "For a scenario with cases: pass only if every case with gating true (or without a gating flag) is pass; cases with gating false never change it. For S2.7 in an S2 spike-run record: the outcome of the automated step checks only; the final S2.7 outcome comes from the review record, and a failed step check makes it fail without review."
        },
        "duration_s": { "type": "number", "minimum": 0 },
        "cases": {
          "type": "array",
          "items": {
            "type": "object",
            "required": ["id", "outcome"],
            "additionalProperties": false,
            "properties": {
              "id": { "type": "string", "description": "<scenario id>:<case>, for example S3.2:post:M5:poweroff" },
              "outcome": { "enum": ["pass", "fail", "error", "skipped", "flaky"] },
              "gating": {
                "type": "boolean",
                "default": true,
                "description": "False for an informational variant case (S1.2, S1.6, S1.8: create policy lus, passthrough.io=rw, cache.files=auto-full): its outcome and evidence are recorded but never change the scenario outcome or the verdict. Absent means true."
              },
              "fault_point": { "type": "string" },
              "fault_kind": { "type": "string" }
            }
          }
        },
        "evidence": {
          "type": "array",
          "description": "Entries inside evidence.tar.xz.",
          "items": {
            "type": "object",
            "required": ["path", "sha256"],
            "additionalProperties": false,
            "properties": {
              "path": { "type": "string", "pattern": "^[^/].*$" },
              "sha256": { "type": "string", "pattern": "^[0-9a-f]{64}$" }
            }
          }
        },
        "notes": { "type": "string" }
      }
    }
  }
}
